{"3246817":["{{chú thích web|url= http://olympia.vtv.vn/gioi-thieu.htm|tiêu đề= CHƯƠNG TRÌNH ĐƯỜNG LÊN ĐỈNH OLYMPIA |ngôn ngữ= vi|nhà xuất bản= Olympia.vtv.vn|ngày truy cập= ngày 6 tháng 9 năm 2015|archiveurl= https://web.archive.org/web/20150907021019/http://olympia.vtv.vn/gioi-thieu.htm|archive-date= ngày 7 tháng 9 năm 2015|quote=...Đài Truyền hình Việt Nam đã hợp tác cùng công ty điện tử LG Việt Nam nghiên cứu sản xuất một chương trình mới cho khán giả trẻ...}}","{{Collapsible list\n | expand = \n | framestyle = \n | titlestyle = \n | title = Danh sách\n | liststyle =\n | hlist = \n | bullets = \n | PGS.TS.NGƯT Nguyễn Đức Chuy\n | Nguyên CVCC Bộ GD&ĐT Nhà giáo Trần Trọng Hà\n | Nhà sử học Lê Văn Lan\n | PGS.TS Nguyễn Quang Vinh\n | Nhà Giáo Đỗ Kim Hồi\n | PGS.TS.NGND Lê Đình Trung \n | PGS.TSKH.NGND Nguyễn Thế Khôi\n | Nhà báo Nguyễn Như Mai\n | PGS.TS Phan Doãn Thoại\n | PGS.TS Vũ Quốc Trung\n | Nhà báo Trương Anh Ngọc\n | Tổ chức GD&ĐT Apollo VN\n}}","{{VNM}}","{{{italic title|no}}}\n| bodystyle      = width: 24em\n\n| titlestyle     = italic\n| abovestyle     = background:#CC1C1C; color:#FFFFFF\n| subheaderstyle =\n\n| title          = \n| above          = ''Đường lên đỉnh Olympia năm thứ 16''\n| subheader      = '''Olympia, chúng ta là một gia đình!'''\n\n|   imagestyle   = \n| captionstyle   = \n|   image        = [[Tập tin:Olympia 16 logo.JPG|250px]]\n| caption        = Hình hiệu Đường lên đỉnh Olympia năm thứ 16 (dùng trong khoảng thời gian từ năm 2015 - 2016)\n|   image2       = \n| caption2       =\n\n| headerstyle    = background:#CC1C1C; color:#FFFFFF\n|  labelstyle    = width= 30%\n|   datastyle    = \n| header1  = \n|  label1  = Tên khác\n|   data1  = '''''Olympia 16<br>O16'''''\n| header2  = \n|  label2  = Thể loại\n|   data2  = [[Trò chơi truyền hình]]\n| header3  = \n|  label3  = Phân loại\n|   data3  = '''TV-G''': dành cho mọi lứa tuổi\n| header4  = \n|  label4  = Sáng lập\n|   data4  = [[Đài Truyền hình Việt Nam]]<ref name=\"GTCT\">{{chú thích web|url= http://olympia.vtv.vn/gioi-thieu.htm|tiêu đề= CHƯƠNG TRÌNH ĐƯỜNG LÊN ĐỈNH OLYMPIA |ngôn ngữ= vi|nhà xuất bản= Olympia.vtv.vn|ngày truy cập= ngày 6 tháng 9 năm 2015|archiveurl= https://web.archive.org/web/20150907021019/http://olympia.vtv.vn/gioi-thieu.htm|archive-date= ngày 7 tháng 9 năm 2015|quote=...Đài Truyền hình Việt Nam đã hợp tác cùng công ty điện tử LG Việt Nam nghiên cứu sản xuất một chương trình mới cho khán giả trẻ...}}<\/ref>  <br> Bộ Giáo dục & Đào tạo <br> Công ty thương hiệu vàng NCC (Golden Brand Corp) \n| header5  = \n|  label5  = Dẫn chương trình\n|   data5  = Nguyễn Tùng Chi\n\nPhạm Ngọc Huy\n\nDẫn các điểm cầu trong trận chung kết\n\nĐiểm cầu Nam Định: MC TRẦN NGỌC & MC LƯU MINH VŨ\n\nĐiểm cầu Thừa Thiên Huế: MC ĐỨC BẢO\n\nĐiểm cầu Đắk Lắk: MC QUỲNH TRANG\n\nĐiểm cầu Hà Nội: MC MAI TRANG\n| header6  = \n|  label6  = Cố vấn\n|   data6  =\n{{Collapsible list\n | expand = \n | framestyle = \n | titlestyle = \n | title = Danh sách\n | liststyle =\n | hlist = \n | bullets = \n | PGS.TS.NGƯT Nguyễn Đức Chuy\n | Nguyên CVCC Bộ GD&ĐT Nhà giáo Trần Trọng Hà\n | Nhà sử học Lê Văn Lan\n | PGS.TS Nguyễn Quang Vinh\n | Nhà Giáo Đỗ Kim Hồi\n | PGS.TS.NGND Lê Đình Trung \n | PGS.TSKH.NGND Nguyễn Thế Khôi\n | Nhà báo Nguyễn Như Mai\n | PGS.TS Phan Doãn Thoại\n | PGS.TS Vũ Quốc Trung\n | Nhà báo Trương Anh Ngọc\n | Tổ chức GD&ĐT Apollo VN\n}}\n| header7  = \n|  label7  = Nhạc mở đầu\n|   data7  = \n| header8  = \n|  label8  = Quốc gia\n|   data8  = {{VNM}}\n| header9  = \n|  label9  = Ngôn ngữ\n|   data9  = [[Tiếng Việt]]\n| header10 = Sản xuất<br><ref name=\"O16_111\"/><ref name=\"O16_311\"/><ref name=\"O16_11\"/><ref name=\"O16_221\"/><ref name=\"O16_321\"/><ref name=\"O16_131\"/><ref name=\"O16_231\"/><br />\n|  label10 = \n|   data10 = \n| header11 = \n|  label11 = Địa điểm\n|   data11 = \n*Trường quay S14\n*Trường quay S15 (7 trận còn lại của Quý 4)\n| header12 =\n|  label12 = Tổng đạo diễn\n|   data12 = Nguyễn Tùng Chi<br>\nPhạm Ngọc Huy\n| header13 = \n|  label13 = Tổ chức SX\n|   data13 = Ngô Thu Thảo\n| header14 = \n|  label14 = Chủ nhiệm\n|   data14 = Dương Thị Thu Hà<br>Đỗ Quang Đức\n| header15 = \n|  label15 = Kịch bản\n|   data15 = Phan Tiến Dũng<br>Dương Thị Thu Hà<br>Ngô Thu Thảo\n| header16 = \n|  label16 = Đạo diễn hình\n|   data16 = Lý Hải Thanh\n| header17 = \n|  label17 = Biên tập\n|   data17 = Phan Tiến Dũng<br>Ngô Thu Thảo<br>Phạm Ngọc Huy<br>Dương Thị Thu Hà\n| header18 = \n|  label18 = Trợ lý\n|   data18 = Đỗ Quang Đức<br>Phạm Thị Thùy Trang<br>Nguyễn Thị Quỳnh Châu\n| header19 = \n|  label19 = Cộng tác viên\n|   data19 = Anh Kiệt - Thu Quyên<br>Văn Chính - Kim Tuyến<br>Trọng Lân - Nguyễn Tiếp<br>Nguyễn Hoàng\n| header20 = \n|  label20 = Âm nhạc\n|   data20 = Lưu Hà An\n| header21 = Phát sóng\n|  label21 = \n|   data21 = \n| header22 = \n|  label22 = Thời gian\n|   data22 = 23/08/2015 - 21/08/2016<br>\u2014 Đã dừng phát sóng \u2014\n| header23 = \n|  label23 = Kênh\n|   data23 = [[VTV3]]<br>\n[[VTV4]]<!-- Không được thêm (các) logo vào đây nếu chưa bàn qua phần thảo luận -->\n| header24 = \n|  label24 = Thời lượng\n|   data24 = 60 phút\n| header32 = Vị trí\n|  label32 = \n|   data32 = \n| header33 = \n|  label33 = Mùa trước\n|   data33 = [[Đường lên đỉnh Olympia năm thứ 15]]\n| header34 = \n|  label34 = Mùa sau\n|   data34 = [[Đường lên đỉnh Olympia năm thứ 17]]\n| header35 = Liên kết ngoài\n|  label35 = \n|   data35 = \n| header36 = \n|  label36 = Trang web\n|   data36 = [http://olympia.vtv.vn]\n| header37 =\n|  label37 = Mạng xã hội\n|   data37 = [https://www.facebook.com/duonglendinholympia?fref=ts/ Facebook]\n\n| belowstyle     =\n| below          = \n}}","{{chú thích web|url=http://vtv.vn/truyen-hinh/chung-ket-duong-len-dinh-olympia-thanh-chuong-dang-quang-ngoi-vi-vo-dich-20160821033655677.htm|title=Chung kết Đường lên đỉnh Olympia: Thanh Chương đăng quang ngôi vị vô địch|ngày=2016-08-21|ngày truy cập=2016-08-21|archiveurl=https://web.archive.org/web/20160821042319/http://vtv.vn/truyen-hinh/chung-ket-duong-len-dinh-olympia-thanh-chuong-dang-quang-ngoi-vi-vo-dich-20160821033655677.htm|archive-date = ngày 21 tháng 8 năm 2016 |url-status=live}}","{{chú thích web|url= http://olympia.vtv.vn/luat-choi.htm|tiêu đề= LUẬT CHƠI ĐƯỜNG LÊN ĐỈNH OLYMPIA|ngôn ngữ= vi|nhà xuất bản= olympia.vtv.vn|ngày truy cập= ngày 7 tháng 9 năm 2015|archiveurl= https://web.archive.org/web/20150907022214/http://olympia.vtv.vn/luat-choi.htm|archive-date= ngày 7 tháng 9 năm 2015}}","{{Infobox\n|    title = Đường lên đỉnh Olympia năm thứ 16\n| headerstyle    = background:#CC1C1C; color:#FFFFFF\n|  labelstyle    = \n|   datastyle    = \n| header1  = Tổng kết\n|  label1  = \n|   data1  =\n| header2  = \n|  label3  = Tổng số trận\n|   data3  = 53\n| header3  = \n|  label2  = Tổng số thí sinh\n|   data2  = \n|  label4  = Vô địch\n|   data4  = Hồ Đắc Thanh Chương<br>Trung học phổ thông chuyên Quốc học, Thừa Thiên Huế\n| header5  = \n|  label5  = Kỷ lục\n|   data5  = Lê Duy Bách - 380 điểm<br>THPT chuyên Hà Nội-Amsterdam, Hà Nội\n| header6  = Chung kết năm\n|  label6  = \n|   data6  = \n| header7  = \n|  label7  = Quý 1\n|   data7  = Lê Duy Bách\n| header8  =  \n|  label8  = Quý 2\n|   data8  = Hồ Đắc Thanh Chương\n| header9  = \n|  label9  = Quý 3\n|   data9  = Lâm Vũ Tuấn\n| header10 = \n|  label10 = Quý 4\n|   data10 = Phan Tiến Tùng\n}}","{{chú thích web|url= http://vtv.vn/video/duong-len-dinh-olympia-23-8-2015-89603.htm|tiêu đề= Đường lên đỉnh Olympia - 23/8/2015|ngày= ngày 23 tháng 8 năm 2015|ngày truy cập= ngày 23 tháng 8 năm 2015|nhà xuất bản= vtv.vn|ngôn ngữ= vi|archiveurl= https://www.webcitation.org/6bQZABr65?url=http://vtv.vn/video/duong-len-dinh-olympia-23-8-2015-89603.htm|archive-date = ngày 10 tháng 9 năm 2015 |url-status=live}}","{{chú thích web|url= http://vtv.vn/video/duong-len-dinh-olympia-30-8-2015-90557.htm|tiêu đề= Đường lên đỉnh Olympia - 30/8/2015|ngôn ngữ= vi|ngày= ngày 30 tháng 8 năm 2015|ngày truy cập= ngày 30 tháng 8 năm 2015|nhà xuất bản= vtv.vn|archiveurl= https://www.webcitation.org/6bQZKPaKN?url=http://vtv.vn/video/duong-len-dinh-olympia-30-8-2015-90557.htm|archive-date = ngày 10 tháng 9 năm 2015 |url-status=live}}","{{chú thích web| url = http://vtv.vn/video/duong-len-dinh-olympia-06-9-2015-91471.htm| tiêu đề = Đường lên đỉnh Olympia - 06/9/2015| ngôn ngữ = vi| nhà xuất bản = vtv.vn| ngày = ngày 6 tháng 9 năm 2015| ngày truy cập = ngày 6 tháng 9 năm 2015| archiveurl = https://www.webcitation.org/6bQZTd0O8?url=http://vtv.vn/video/duong-len-dinh-olympia-06-9-2015-91471.htm| archive-date = ngày 10 tháng 9 năm 2015 | url-status=live}}","{{chú thích web|url= http://vtv.vn/video/duong-len-dinh-olympia-13-9-2015-92484.htm|tiêu đề= Đường lên đỉnh Olympia - 13/9/2015|ngôn ngữ= vi|nhà xuất bản= vtv.vn|ngày= 2015-09-13|ngày truy cập= 2015-09-13|archiveurl= https://www.webcitation.org/6bVpCdSEU?url=http://vtv.vn/video/duong-len-dinh-olympia-13-9-2015-92484.htm|archive-date = ngày 13 tháng 9 năm 2015 |url-status=live}}","{{chú thích web|url= http://vtv.vn/video/duong-len-dinh-olympia-20-9-2015-93523.htm|tiêu đề= Đường lên đỉnh Olympia - 20/9/2015|ngôn ngữ= vi|nhà xuất bản= vtv.vn|ngày= 2015-09-20|ngày truy cập= 2015-09-20|archiveurl= https://www.webcitation.org/6bgCkLuPh?url=http://vtv.vn/video/duong-len-dinh-olympia-20-9-2015-93523.htm|archive-date = ngày 20 tháng 9 năm 2015 |url-status=live}}","{{chú thích web|url= http://vtv.vn/video/duong-len-dinh-olympia-27-9-2015-94599.htm|tiêu đề= Đường lên đỉnh Olympia - 27/9/2015|ngôn ngữ= vi|nhà xuất bản= vtv.vn|ngày truy cập= 2015-09-27|archiveurl= https://www.webcitation.org/6br7mLyN5?url=http://vtv.vn/video/duong-len-dinh-olympia-27-9-2015-94599.htm|archive-date = ngày 27 tháng 9 năm 2015 |url-status=live}}","{{chú thích web|url= http://vtv.vn/video/duong-len-dinh-olympia-04-10-2015-95636.htm|tiêu đề= Đường lên đỉnh Olympia - 04/10/2015|ngôn ngữ= vi|nhà xuất bản= vtv.vn|ngày= 2015-10-04|ngày truy cập= 2015-10-05|archiveurl= https://www.webcitation.org/6c2pGYdFc?url=http://vtv.vn/video/duong-len-dinh-olympia-04-10-2015-95636.htm|archive-date = ngày 5 tháng 10 năm 2015 |url-status=live}}","{{chú thích web|url= http://vtv.vn/video/duong-len-dinh-olympia-11-10-2015-96651.htm|title= Đường lên đỉnh Olympia - 11/10/2015|ngôn ngữ= vi|ngày= 2015-10-11|ngày truy cập= 2015-10-11|archiveurl= https://www.webcitation.org/6cCWsjOpx?url=http://vtv.vn/video/duong-len-dinh-olympia-11-10-2015-96651.htm?mobile=true|archive-date = ngày 11 tháng 10 năm 2015 |url-status=live}}","{{chú thích web|url = http://vtv.vn/video/duong-len-dinh-olympia-18-10-2015-97656.htm|tiêu đề = Đường lên đỉnh Olympia - 18/10/2015|nhà xuất bản = vtv.vn|ngôn ngữ = vi|ngày = 2015-10-18|ngày truy cập = 2015-10-18|archiveurl = https://www.webcitation.org/6cMuSM13r?url=http://vtv.vn/video/duong-len-dinh-olympia-18-10-2015-97656.htm|archive-date = ngày 18 tháng 10 năm 2015 |url-status=live}}","{{chú thích web|url=http://vtv.vn/video/duong-len-dinh-olympia-25-10-2015-99141.htm|title=Đường lên đỉnh Olympia ngày 25/10/2015|nhà xuất bản=vtv.vn|ngày=2015-10-25|ngày truy cập=2015-10-27|archiveurl=https://www.webcitation.org/6capqN6hJ?url=http://vtv.vn/video/duong-len-dinh-olympia-25-10-2015-99141.htm?mobile=true|archive-date = ngày 27 tháng 10 năm 2015 |url-status=live}}","{{chú thích web|url= http://vtv.vn/video/duong-len-dinh-olympia-01-11-2015-99853.htm|tiêu đề= Đường lên đỉnh Olympia - 01/11/2015|nhà xuất bản= vtv.vn|ngày= 2015-11-01|ngày truy cập= 2015-11-01|archiveurl= https://www.webcitation.org/6ciSpoVAf?url=http://vtv.vn/video/duong-len-dinh-olympia-01-11-2015-99853.htm|archive-date = ngày 1 tháng 11 năm 2015 |url-status=live}}","{{chú thích web|url= http://vtv.vn/video/duong-len-dinh-olympia-08-11-2015-100923.htm| tiêu đề= Đường lên đỉnh Olympia - 08/11/2015|ngôn ngữ= vi| nhà xuất bản= vtv.vn| ngày= 2015-11-08| ngày truy cập= 2015-12-04|archiveurl= https://web.archive.org/web/20151204035449/http://vtv.vn/video/duong-len-dinh-olympia-08-11-2015-100923.htm| archive-date = ngày 8 tháng 12 năm 2015}}","{{chú thích web| url= http://vtv.vn/video/duong-len-dinh-olympia-15-11-2015-102042.htm| title= Đường lên đỉnh Olympia - 15/11/2015| ngôn ngữ= vi| nhà xuất bản= vtv.vn| ngày= 2015-11-15| ngày truy cập= 2015-12-04| archiveurl=https://web.archive.org/web/20151204035354/http://vtv.vn/video/duong-len-dinh-olympia-15-11-2015-102042.htm| archive-date = ngày 4 tháng 12 năm 2015}}","{{chú thích web| url= http://vtv.vn/video/duong-len-dinh-olympia-22-11-2015-103111.htm| tiêu đề=Đường lên đỉnh Olympia - 22/11/2015| ngôn ngữ= vi| nhà xuất bản= vtv.vn| ngày= 2015-11-22| ngày truy cập= 2015-12-04| archiveurl=https://web.archive.org/web/20151204035648/http://vtv.vn/video/duong-len-dinh-olympia-22-11-2015-103111.htm| archive-date = ngày 4 tháng 12 năm 2015}}","{{chú thích web| url= http://vtv.vn/video/duong-len-dinh-olympia-29-11-2015-104267.htm| tiêu đề=Đường lên đỉnh Olympia - 29/11/2015| ngôn ngữ= vi| nhà xuất bản= vtv.vn| ngày= 2015-11-29| ngày truy cập= 2015-12-04| archiveurl=https://web.archive.org/web/20151204040512/http://vtv.vn/video/duong-len-dinh-olympia-29-11-2015-104267.htm| archive-date = ngày 4 tháng 12 năm 2015}}","{{chú thích web| url=http://vtv.vn/video/duong-len-dinh-olympia-06-12-2015-105383.htm| tiêu đề=Đường lên đỉnh Olympia - 06/12/2015| ngôn ngữ=vi| ngày=2015-12-06| ngày truy cập=2015-12-06| archiveurl=https://web.archive.org/web/20151207020240/http://vtv.vn/video/duong-len-dinh-olympia-06-12-2015-105383.htm| archive-date = ngày 7 tháng 12 năm 2015 | url-status=dead}}","{{chú thích web| url= http://m.vtv.vn/video/duong-len-dinh-olympia-13-12-2015-106503.htm| tiêu đề= Đường lên đỉnh Olympia - 13/12/2015| ngôn ngữ= vi| nhà xuất bản= vtv.vn| ngày= 2015-12-13| ngày truy cập= 2015-12-18| archiveurl= https://web.archive.org/web/20151218104849/http://m.vtv.vn/video/duong-len-dinh-olympia-13-12-2015-106503.htm| archive-date = ngày 18 tháng 12 năm 2015 | url-status=dead}}","{{ chú thích web| url= http://vtv.vn/video/duong-len-dinh-olympia-20-12-2015-107583.htm | tiêu đề= Đường lên đỉnh Olympia - 20/12/2015 | ngôn ngữ= vi| nhà xuất bản= vtv.vn| ngày= 2015-12-20| ngày truy cập= 2015-12-24| archiveurl= https://web.archive.org/web/20151224114751/http://vtv.vn/video/duong-len-dinh-olympia-20-12-2015-107583.htm?mobile=true| archive-date = ngày 24 tháng 12 năm 2015}}","{{chú thích web|url=http://vtv.vn/video/duong-len-dinh-olympia-27-12-2015-109347.htm|tiêu đề=Đường lên đỉnh Olympia - 27/12/2015|ngôn ngữ=vi|nhà xuất bản=vtv.vn|ngày=2015-12-27|ngày truy cập=2015-01-03|archiveurl=https://www.webcitation.org/6eFUF1vJe?url=http://vtv.vn/video/duong-len-dinh-olympia-27-12-2015-109347.htm|archive-date = ngày 3 tháng 1 năm 2016 |url-status=live}}","{{chú thích web|url=http://vtv.vn/video/duong-len-dinh-olympia-03-01-2016-109800.htm|tiêu đề=Đường lên đỉnh Olympia - 03/01/2016|ngày=2016-01-03|ngày truy cập=2016-01-20|ngôn ngữ=vi|nhà xuất bản=vtv.vn|archiveurl=https://www.webcitation.org/6eubruxI0?url=http://vtv.vn/video/duong-len-dinh-olympia-03-01-2016-109800.htm|archive-date = ngày 30 tháng 1 năm 2016 |url-status=live}}","{{chú thích web|url=http://vtv.vn/video/duong-len-dinh-olympia-10-01-2016-111090.htm|title=Đường lên đỉnh Olympia - 10/01/2016|ngôn ngữ=vi|nhà xuất bản=vtv.vn|ngày=2016-01-10|ngày truy cập=2016-01-20|archiveurl=https://www.webcitation.org/6eucMpnVB?url=http://vtv.vn/video/duong-len-dinh-olympia-10-01-2016-111090.htm|archive-date = ngày 30 tháng 1 năm 2016 |url-status=live}}","{{chú thích web|url=http://vtv.vn/video/duong-len-dinh-olympia-17-01-2016-112408.htm|title=Đường lên đỉnh Olympia - 17/01/2016|ngôn ngữ=vi|nhà xuất bản=vtv.vn|ngày=2016-01-17|ngày truy cập=2016-01-20|archiveurl=https://www.webcitation.org/6eucnKhOl?url=http://vtv.vn/video/duong-len-dinh-olympia-17-01-2016-112408.htm|archive-date = ngày 30 tháng 1 năm 2016 |url-status=live}}","{{chú thích web|url=http://vtv.vn/video/duong-len-dinh-olympia-24-01-2016-114812.htm|tiêu đề=Đường lên đỉnh Olympia - 24/01/2016|ngôn ngữ= vi|nhà xuất bản=vtv.vn|ngày=2016-01-30|ngày truy cập= 2016-01-31|archive-date = ngày 31 tháng 1 năm 2016 |archiveurl=https://web.archive.org/web/20160131144902/http://vtv.vn/video/duong-len-dinh-olympia-24-01-2016-114812.htm}}","{{chú thích web|url=http://vtv.vn/video/duong-len-dinh-olympia-02-02-2016-115200.htm|title=Đường lên đỉnh Olympia - 31/01/2016|ngôn ngữ=vi|nhà xuất bản=vtv.vn|ngày=2016-02-02|ngày truy cập=2016-02-02|archiveurl=https://www.webcitation.org/6ezTXRAiK?url=http://vtv.vn/video/duong-len-dinh-olympia-02-02-2016-115200.htm|archive-date = ngày 2 tháng 2 năm 2016 |url-status=live}}","{{chú thích web|url=http://vtv.vn/video/duong-len-dinh-olympia-07-02-2016-116075.htm|title=Đường lên đỉnh Olympia - 07/02/2016|ngôn ngữ=vi|nhà xuất bản=vtv.vn|ngày=2016-02-07|ngày truy cập=2016-02-10|archiveurl=https://www.webcitation.org/6fC3R7qKQ?url=http://vtv.vn/video/duong-len-dinh-olympia-07-02-2016-116075.htm|archive-date = ngày 10 tháng 2 năm 2016 |url-status=live}}","{{chú thích web|url=http://vtv.vn/video/duong-len-dinh-olympia-14-02-2016-116858.htm|title=Đường lên đỉnh Olympia - 14/02/2016|ngôn ngữ=vi|nhà xuất bản=vtv.vn|ngày=2016-02-14|ngày truy cập=2016-02-17|archiveurl=https://www.webcitation.org/6fM5xWRtf?url=http://vtv.vn/video/duong-len-dinh-olympia-14-02-2016-116858.htm|archive-date = ngày 17 tháng 2 năm 2016 |url-status=live}}","{{chú thích web|url=http://vtv.vn/video/duong-len-dinh-olympia-21-02-2016-118047.htm|title=Đường lên đỉnh Olympia - 21/02/2016|ngôn ngữ=vi|publisher=vtv.vn|ngày=2016-02-21|ngày truy cập=2016-03-12|archiveurl=https://www.webcitation.org/6fweHyw0r?url=http://vtv.vn/video/duong-len-dinh-olympia-21-02-2016-118047.htm|archive-date = ngày 12 tháng 3 năm 2016 |url-status=live}}","{{chú thích web|url=http://vtv.vn/video/duong-len-dinh-olympia-28-02-2016-119378.htm|title=Đường lên đỉnh Olympia - 28/02/2016|ngôn ngữ=vi|nhà xuất bản=vtv.vn|ngày=2016-02-28|ngày truy cập=2016-03-12|archiveurl=https://www.webcitation.org/6fwffjRLD?url=http://vtv.vn/video/duong-len-dinh-olympia-28-02-2016-119378.htm|archive-date = ngày 12 tháng 3 năm 2016 |url-status=live}}","{{chú thích web|url=http://vtv.vn/video/duong-len-dinh-olympia-06-3-2016-120717.htm|title=Đường lên đỉnh Olympia - 06/3/2016|ngôn ngữ=vi|nhà xuất bản=vtv.vn|ngày=2016-03-03|ngày truy cập=2016-03-12|archiveurl=https://www.webcitation.org/6fwfA3TzW?url=http://vtv.vn/video/duong-len-dinh-olympia-06-3-2016-120717.htm|archive-date = ngày 12 tháng 3 năm 2016 |url-status=live}}","{{chú thích web|url=http://vtv.vn/video/duong-len-dinh-olympia-13-3-2016-122596.htm|title=Đường lên đỉnh Olympia - 13/3/2016|ngôn ngữ=vi|publisher=vtv.vn|ngày=2016-03-13|ngày truy cập=2016-03-20|archiveurl=https://web.archive.org/web/20160402170925/http://vtv.vn/video/duong-len-dinh-olympia-13-3-2016-122596.htm|archive-date=2016-04-02|url-status=bot: unknown}}","{{chú thích web|url=http://vtv.vn/video/duong-len-dinh-olympia-20-3-2016-123457.htm|title=Đường lên đỉnh Olympia - 20/3/2016|ngôn ngữ=vi|publisher=vtv.vn|ngày=2016-03-20|ngày truy cập=2016-03-21|archiveurl=https://www.webcitation.org/6g9QtjhSw?url=http://vtv.vn/video/duong-len-dinh-olympia-20-3-2016-123457.htm|archive-date = ngày 20 tháng 3 năm 2016 |url-status=live}}","{{chú thích web|url=http://vtv.vn/video/duong-len-dinh-olympia-27-3-2016-124877.htm|title=Đường lên đỉnh Olympia - 27/3/2016|ngôn ngữ=vi|nhà xuất bản=vtv.vn|ngày=2016-03-27|ngày truy cập=2016-04-03|archiveurl=https://www.webcitation.org/6gURUIsiH?url=http://vtv.vn/video/duong-len-dinh-olympia-27-3-2016-124877.htm|archive-date = ngày 3 tháng 4 năm 2016 |url-status=live}}","{{chú thích web|url=http://vtv.vn/video/duong-len-dinh-olympia-03-4-2016-126305.htm|title=Đường lên đỉnh Olympia - 03/4/2016|ngôn ngữ=vi|publisher=vtv.vn|ngày=2016-04-03|ngày truy cập=2016-04-03|archiveurl=https://www.webcitation.org/6gURJjJkm?url=http://vtv.vn/video/duong-len-dinh-olympia-03-4-2016-126305.htm|archive-date = ngày 3 tháng 4 năm 2016 |url-status=live}}","{{chú thích web|url=http://vtv.vn/video/duong-len-dinh-olympia-10-4-2016-127755.htm|title=Đường lên đỉnh Olympia - 10/4/2016|ngôn ngữ=vi|ngày=2016-04-10|ngày truy cập=2016-06-29|nhà xuất bản=vtv.vn|archiveurl=https://web.archive.org/web/20160629034116/http://vtv.vn/video/duong-len-dinh-olympia-10-4-2016-127755.htm|archive-date = ngày 29 tháng 6 năm 2016 |url-status=live}}","{{chú thích web|url=http://vtv.vn/video/duong-len-dinh-olympia-17-4-2016-129219.htm|title=Đường lên đỉnh Olympia - 17/4/2016|ngôn ngữ=vi|ngày=2016-06-17|ngày truy cập=2016-06-29|nhà xuất bản=vtv.vn|archiveurl=https://web.archive.org/web/20160629034756/http://vtv.vn/video/duong-len-dinh-olympia-17-4-2016-129219.htm|archive-date = ngày 29 tháng 6 năm 2016 |url-status=live}}","{{chú thích web|url=http://vtv.vn/video/duong-len-dinh-olympia-01-5-2016-132034.htm|title=Đường lên đỉnh Olympia - 01/5/2016|ngày=2016-05-01|ngày truy cập=2016-06-29|nhà xuất bản=vtv.vn|archiveurl=https://web.archive.org/web/20160629035712/http://vtv.vn/video/duong-len-dinh-olympia-01-5-2016-132034.htm|archive-date = ngày 29 tháng 6 năm 2016 |url-status=live}}","{{chú thích web|url=http://vtv.vn/video/duong-len-dinh-olympia-08-5-2016-133342.htm|title=Đường lên đỉnh Olympia - 08/5/2016|ngày=2016-05-08|ngày truy cập=2016-06-29|nhà xuất bản=vtv.vn|archiveurl=https://web.archive.org/web/20160629035931/http://vtv.vn/video/duong-len-dinh-olympia-08-5-2016-133342.htm|archive-date = ngày 29 tháng 6 năm 2016 |url-status=live}}","{{chú thích web|url=http://vtv.vn/video/duong-len-dinh-olympia-15-5-2016-134817.htm|title=Đường lên đỉnh Olympia - 15/5/2016|ngày=2016-05-15|ngày truy cập=2016-06-29|nhà xuất bản=vtv.vn|archiveurl=https://web.archive.org/web/20160629040109/http://vtv.vn/video/duong-len-dinh-olympia-15-5-2016-134817.htm|archive-date = ngày 29 tháng 6 năm 2016 |url-status=live}}","{{chú thích web|url=http://vtv.vn/video/duong-len-dinh-olympia-22-5-2016-136263.htm|title=Đường lên đỉnh Olympia - 22/5/2016|ngày=2016-05-22|ngày truy cập=2016-06-29|nhà xuất bản=vtv.vn|archiveurl=https://web.archive.org/web/20160629040241/http://vtv.vn/video/duong-len-dinh-olympia-22-5-2016-136263.htm|archive-date = ngày 29 tháng 6 năm 2016 |url-status=live}}","{{chú thích web|url=http://vtv.vn/video/duong-len-dinh-olympia-29-5-2016-137691.htm|title=Đường lên đỉnh Olympia - 29/5/2016|ngày=2016-05-29|ngày truy cập=2016-06-29|nhà xuất bản=vtv.vn|archiveurl=https://web.archive.org/web/20160629040431/http://vtv.vn/video/duong-len-dinh-olympia-29-5-2016-137691.htm|archive-date = ngày 29 tháng 6 năm 2016 |url-status=live}}","{{chú thích web|url=http://vtv.vn/video/duong-len-dinh-olympia-05-6-2016-151800.htm|title=Đường lên đỉnh Olympia - 05/6/2016|ngày=2016-06-05|ngày truy cập=2016-06-29|nhà xuất bản=vtv.vn|archiveurl=https://web.archive.org/web/20160629040553/http://vtv.vn/video/duong-len-dinh-olympia-05-6-2016-151800.htm|archive-date = ngày 29 tháng 6 năm 2016 |url-status=live}}","{{chú thích web|url=http://vtv.vn/video/duong-len-dinh-olympia-12-6-2016-153362.htm|title=Đường lên đỉnh Olympia - 12/6/2016|ngày=2016-06-12|ngày truy cập=2016-06-29|nhà xuất bản=vtv.vn|archiveurl=https://web.archive.org/web/20160629040720/http://vtv.vn/video/duong-len-dinh-olympia-12-6-2016-153362.htm|archive-date = ngày 29 tháng 6 năm 2016 |url-status=live}}","{{chú thích web|url=http://vtv.vn/video/duong-len-dinh-olympia-19-6-2016-154927.htm|title=Đường lên đỉnh Olympia - 19/6/2016|ngày=2016-06-19|ngày truy cập=2016-06-29|nhà xuất bản=vtv.vn|archiveurl=https://web.archive.org/web/20160629040835/http://vtv.vn/video/duong-len-dinh-olympia-19-6-2016-154927.htm|archive-date = ngày 29 tháng 6 năm 2016 |url-status=live}}","{{chú thích web|url=http://vtv.vn/video/duong-len-dinh-olympia-26-6-2016-156492.htm|title=Đường lên đỉnh Olympia - 26/6/2016|ngày=2016-06-26|ngày truy cập=2016-06-29|nhà xuất bản=vtv.vn|archiveurl=https://web.archive.org/web/20160629041000/http://vtv.vn/video/duong-len-dinh-olympia-26-6-2016-156492.htm|archive-date = ngày 29 tháng 6 năm 2016 |url-status=live}}","{{Ref|5|GC5}}","{{Ref|16|GC16}}","{{Ref|9|GC9}}","{{Ref|12|GC12}}","{{Ref|17|GC17}}","{{Ref|8|GC8}}","{{Ref|10|GC10}}","{{Ref|11|GC11}}","{{Ref|18|GC18}}","{{Ref|2|GC2}}","{{Ref|4|GC4}}","{{Ref|3|GC3}}","{{Ref|7|GC7}}","{{Ref|15|GC15}}","{{Ref|13|GC13}}","{{Ref|1|GC1}}","{{ref|6|GC6}}","{{Ref|14|GC14}}","{{Đường lên đỉnh Olympia}}","{{refbegin}}","{{note|1}}","{{note|2}}","{{note|3}}","{{note|4}}","{{note|5}}","{{note|6}}","{{note|7}}","{{note|8}}","{{note|9}}","{{Note|10}}","{{Note|11}}","{{Note|12}}","{{Note|13}}","{{Note|14}}","{{Note|15}}","{{Note|16}}","{{note|17}}","{{refend}}","{{tham khảo|30em}}","{{Đường lên đỉnh Olympia}}"]}